nombre,indipais,telefono,lugar-de-la-cita,fecha-de-la-cita,hora-de-la-cita,nombre-del-doctor,,
 Luisa Fernanda  Ortiz Ortiz,57,3126913296,clinica odontosur,31/12/2015,8:00 a. m.,César Augusto Moncada Díez,,
 Paula Andrea Villegas Castaño,57,3012155012,clinica odontosur,31/12/2015,8:20 a. m.,César Augusto Moncada Díez,,
 Mauricio    Hernandez Duque,57,3103813358,clinica odontosur,31/12/2015,8:40 a. m.,César Augusto Moncada Díez,,
Francisco Javier Madrid Serna,57,3152720364,clinica odontosur,31/12/2015,9:00 a. m.,César Augusto Moncada Díez,,
Andres Felipe Mesa Gomez,57,3013969216,clinica odontosur,31/12/2015,9:20 a. m.,César Augusto Moncada Díez,,
Mabel   Zapata Zabala,57,3207884898,clinica odontosur,31/12/2015,8:00 a. m.,Edward Alberto Abadia Guzman,,
Jesus Maria Giraldo Garcia,57,3007811681,clinica odontosur,31/12/2015,9:00 a. m.,Edward Alberto Abadia Guzman,,
monica martinez,57,3043525351,clinica odontosur,31/12/2015,10:00 a. m.,Edward Alberto Abadia Guzman,,
